{"schemaVersion":"1.0","packageId":"pkg_abcdefghijklmnop","protocolVersion":"1.0","cipherSuite":"A256GCM-HIGH-PASS-V1","chunkCount":2,"chunkSize":65536,"packageSize":100000,"createdAt":"2026-09-01T00:00:00Z","expiresAt":"2026-09-02T00:00:00Z","destinationInstitutionRef":"inst_hospital_b","manifestEncrypted":true,"manifestCiphertext":"YWJjZA","keyEnvelopeRefs":["kenv_abcdefghijklmnop"]}
